{
  "$schema": "https://json-schema.org/draft/2020-12/schema",
  "$id": "https://example.invalid/dgx-spark-deepseek-v4-deploy/service-profile.schema.json",
  "title": "Immutable DeepSeek V4 service profile",
  "type": "object",
  "additionalProperties": false,
  "required": ["schema_version", "profile_id", "release_gated_manifest_fields", "platform", "topology", "model", "service", "limits", "parsing", "container", "image", "security"],
  "properties": {
    "schema_version": {"const": 1},
    "profile_id": {"type": "string", "pattern": "^[a-z0-9][a-z0-9-]+$"},
    "release_gated_manifest_fields": {
      "type": "array",
      "uniqueItems": true,
      "items": {
        "enum": ["chat_template", "reasoning_config", "load_format", "linear_backend", "cuda_graph_capture_sizes", "compact_block_stride"]
      }
    },
    "platform": {
      "type": "object",
      "additionalProperties": false,
      "required": ["architecture", "accelerator", "nodes"],
      "properties": {
        "architecture": {"const": "linux/arm64"},
        "accelerator": {"const": "GB10"},
        "nodes": {"const": 2}
      }
    },
    "topology": {
      "type": "object",
      "additionalProperties": false,
      "required": ["tensor_parallel_size", "pipeline_parallel_size", "nnodes", "head_rank", "worker_rank", "worker_first"],
      "properties": {
        "tensor_parallel_size": {"const": 2},
        "pipeline_parallel_size": {"const": 1},
        "nnodes": {"const": 2},
        "head_rank": {"const": 0},
        "worker_rank": {"const": 1},
        "worker_first": {"const": true}
      }
    },
    "model": {
      "type": "object",
      "additionalProperties": false,
      "required": ["family", "served_model_name", "container_path", "model_path"],
      "properties": {
        "family": {"const": "DeepSeek-V4-Flash"},
        "served_model_name": {"const": "deepseek-v4-flash-0731-native432"},
        "container_path": {"const": "/models"},
        "model_path": {"const": "/models/DeepSeek-V4-Flash-0731"}
      }
    },
    "service": {
      "type": "object",
      "additionalProperties": false,
      "required": [
        "attention_backend", "moe_backend", "linear_backend", "distributed_executor_backend",
        "target_kv_cache_dtype", "block_size", "gpu_memory_utilization", "enable_chunked_prefill",
        "long_prefill_token_threshold", "compact_layout", "draft_config_json", "reasoning_config_json",
        "load_format", "prefix_caching", "async_scheduling", "cuda_graph",
        "max_cudagraph_capture_size", "compilation_config_json"
      ],
      "properties": {
        "attention_backend": {"const": "B12X_MLA_SPARSE"},
        "moe_backend": {"const": "b12x"},
        "linear_backend": {"const": "b12x"},
        "distributed_executor_backend": {"const": "mp"},
        "target_kv_cache_dtype": {"const": "nvfp4_ds_mla"},
        "block_size": {"const": 256},
        "gpu_memory_utilization": {"const": 0.85},
        "enable_chunked_prefill": {"const": true},
        "long_prefill_token_threshold": {"const": 0},
        "compact_layout": {
          "type": "object",
          "additionalProperties": false,
          "required": ["abi", "record_bytes"],
          "properties": {"abi": {"const": "dsv4-native432-compact-v1"}, "record_bytes": {"const": 432}}
        },
        "draft_config_json": {"type": "string", "pattern": "^\\{.*\\}$"},
        "reasoning_config_json": {"type": "string", "pattern": "^\\{.*\\}$"},
        "load_format": {"const": "instanttensor"},
        "prefix_caching": {
          "type": "object",
          "additionalProperties": false,
          "required": ["enabled", "hash_algorithm"],
          "properties": {"enabled": {"const": true}, "hash_algorithm": {"const": "sha256"}}
        },
        "async_scheduling": {"const": false},
        "cuda_graph": {
          "type": "object",
          "additionalProperties": false,
          "required": ["enabled", "mode"],
          "properties": {"enabled": {"const": true}, "mode": {"const": "FULL_AND_PIECEWISE"}}
        },
        "max_cudagraph_capture_size": {"const": 64},
        "compilation_config_json": {"type": "string", "pattern": "^\\{.*\\}$"}
      }
    },
    "limits": {
      "type": "object",
      "additionalProperties": false,
      "required": ["max_model_len", "max_num_seqs", "max_num_batched_tokens"],
      "properties": {
        "max_model_len": {"const": 327680},
        "max_num_seqs": {"enum": [5, 10]},
        "max_num_batched_tokens": {"enum": [1024, 8192]}
      }
    },
    "parsing": {
      "type": "object",
      "additionalProperties": false,
      "required": ["tokenizer_mode", "tool_call_parser", "reasoning_parser"],
      "properties": {
        "tokenizer_mode": {"const": "deepseek_v4"},
        "tool_call_parser": {"const": "deepseek_v4"},
        "reasoning_parser": {"const": "deepseek_v4"}
      }
    },
    "container": {
      "type": "object",
      "additionalProperties": false,
      "required": ["name_prefix", "read_only_root", "no_new_privileges"],
      "properties": {
        "name_prefix": {"const": "dsv4-candidate-"},
        "read_only_root": {"const": true},
        "no_new_privileges": {"const": true}
      }
    },
    "image": {
      "type": "object",
      "additionalProperties": false,
      "required": ["lock_path", "candidate_id", "source_refs", "required_labels"],
      "properties": {
        "lock_path": {"const": "image.lock.json"},
        "candidate_id": {"enum": ["dsv4-0731-native432-b12x", "dsv4-0731-native432-b12x-seq10"]},
        "source_refs": {
          "type": "object",
          "additionalProperties": false,
          "required": ["vllm", "b12x"],
          "properties": {
            "vllm": {"const": "release/dsv4-0731-native432-b12x"},
            "b12x": {"const": "release/dsv4-0731-native432"}
          }
        },
        "required_labels": {
          "type": "array",
          "uniqueItems": true,
          "items": {
            "enum": [
              "org.opencontainers.image.revision",
              "com.dgx-spark.architecture",
              "com.dgx-spark.profile_sha256",
              "com.dgx-spark.service_contract_sha256",
              "com.dgx-spark.image_lock_sha256",
              "com.dgx-spark.vllm.commit",
              "com.dgx-spark.b12x.commit"
            ]
          }
        }
      }
    },
    "security": {
      "type": "object",
      "additionalProperties": false,
      "required": ["production_change_allowed", "api_bind_default", "model_mount_read_only"],
      "properties": {
        "production_change_allowed": {"const": false},
        "api_bind_default": {"enum": ["127.0.0.1", "::1"]},
        "model_mount_read_only": {"const": true}
      }
    }
  }
}
